{
  "__comment__": "ILLUSTRATIVE EXAMPLE — NOT CHRIS'S LIVE DATA. The live numbers live only in the browser (localStorage 'woodshed_v1') and cannot be read from disk. Values below are realistic representative defaults derived from the app's code (DEFAULT_S, the hard-coded PR goals, and the EPOCH-based week math for the week of 2026-06-08). PR bests, rung dates, and the streak here are made up to demonstrate shape; tune ids / titles / goals / week math are real and code-accurate. This object validates against mission-control.schema.json.",
  "schemaVersion": "1.0",
  "generatedAt": "2026-06-13T08:40:00.000Z",
  "appStateKey": "woodshed_v1",
  "streak": 6,
  "lastDay": "2026-06-12",
  "week": {
    "index": 22,
    "displayNumber": 23,
    "isoStart": "2026-06-08",
    "dow": 5,
    "focus": "Jam Simulation"
  },
  "primaryTune": "recordame",
  "pinnedTune": null,
  "rotation": [
    "blues", "autumn", "bossa", "atrain", "attya", "four", "beautiful",
    "solar", "twnbay", "oleo", "father", "footprints", "cherokee",
    "confirmation", "misty", "stella", "tingl", "tunisia", "ornithology",
    "missjones", "nowhere", "valentine", "recordame", "bessies"
  ],
  "reviewTunes": ["valentine", "nowhere"],
  "tunes": {
    "recordame": {
      "title": "Recorda Me",
      "rungStatus": 3,
      "rungDates": ["2026-06-08", "2026-06-09", "2026-06-11", null, null],
      "verifiedDate": null,
      "memorized": false,
      "pinned": false
    },
    "valentine": {
      "title": "My Funny Valentine",
      "rungStatus": 5,
      "rungDates": ["2026-05-26", "2026-05-27", "2026-05-28", "2026-05-29", "2026-05-30"],
      "verifiedDate": "2026-06-02",
      "memorized": true,
      "pinned": false
    },
    "nowhere": {
      "title": "Out of Nowhere",
      "rungStatus": 2,
      "rungDates": ["2026-06-01", "2026-06-03", null, null, null],
      "verifiedDate": null,
      "memorized": false,
      "pinned": false
    }
  },
  "weeklyObjectives": [
    { "label": "Primary tune: Recorda Me → rung 5", "current": 1, "target": 2, "met": false },
    { "label": "Vocabulary: +8 lick-keys mastered", "current": 5, "target": 8, "met": false },
    { "label": "Speed: beat ANY tempo PR", "current": 1, "target": 1, "met": true },
    { "label": "Ears: 3 transcription logs", "current": 2, "target": 3, "met": false }
  ],
  "monthlyObjectives": [
    { "label": "Transcribe the first 8 bars of Miles' So What (curriculum LORE hint) — [confirm: not stored in state; populate/edit as you steer]" }
  ],
  "reviewSchedule": {
    "reviewLickId": "L6",
    "reviewTuneIds": ["valentine", "nowhere"],
    "weeklyExam": "Saturday jam-simulation: primary + 2 review tunes, head-in / choruses / head-out, no restarts."
  },
  "prTargets": {
    "ladder": { "best": 152, "goal": 176, "lastLogged": "2026-06-11" },
    "clarke2": { "best": 132, "goal": 144, "lastLogged": "2026-06-12" },
    "single-tongue": { "best": 120, "goal": 132, "lastLogged": "2026-06-12" },
    "16th-triplet": { "best": 104, "goal": 120, "lastLogged": "2026-06-10" }
  }
}
